{
  "title": "Systems Thinking Basics",
  "level": "medium",
  "topic": "Reasoning across constraints",
  "key_points": [
    "Add 3-5 short bullet points here.",
    "Keep each point concrete and learner-friendly."
  ],
  "practice_prompts": [
    "Add 3-6 practice prompts here.",
    "Make prompts short, clear, and answerable."
  ]
}
